{
  "action_contract_version": 1,
  "adapter": "fractal_agent.adapters.grok:normalize",
  "adapter_version": "1.3.0",
  "artifacts": [
    {
      "path": "fractal_agent/adapters/grok.py",
      "sha256": "05d194b6c3db2c397211f5a24770e1362a86eba449bd5621da21a864d7f8d9be",
      "mode": "0644"
    },
    {
      "path": "fractal_agent/adapters/common.py",
      "sha256": "41508ccd3d2392be3df7da3c92ddd39503543b0f3b03961a35d2adaffd32de0a",
      "mode": "0644"
    },
    {
      "path": "fractal_agent/host_bridge.py",
      "sha256": "1c184e070fa8c7ce35e457e0eaae081f51957382b00cfd0785e94dc296656e5c",
      "mode": "0644"
    },
    {
      "path": "activation/grok.json",
      "sha256": "c1e23fd6b3eadad2965f50f8989d0c04a37be5f7d491077c708349a6291c2e67",
      "mode": "0644"
    }
  ],
  "capabilities": {
    "change_detection": "native_post_tool",
    "closeout": "nonblocking_reminder",
    "constraint_delivery_proof": "unsupported",
    "constraints": "active_read",
    "rules": "shared_rules",
    "skills": "shared_agents_dir"
  },
  "id": "grok",
  "manifest_schema_version": 1,
  "owned_node_template_hash": "c1e23fd6b3eadad2965f50f8989d0c04a37be5f7d491077c708349a6291c2e67",
  "owner_id": "ai.fractal.grok.v1",
  "rules_path": "~/.config/fractal-agent/rules/current",
  "skill_source": "~/.agents/skills/fractal-self-description",
  "variants": [
    "grok-cli"
  ],
  "verification": {
    "discover": "native_probe",
    "effective": "native_probe",
    "invoke": "native_probe"
  }
}
