{
  "action_contract_version": 1,
  "adapter": "fractal_agent.adapters.kimi:normalize",
  "adapter_version": "1.3.0",
  "artifacts": [
    {
      "path": "fractal_agent/adapters/kimi.py",
      "sha256": "b1fbfae94c0b1a5922ba2a33947e95d7d564aebe0a6a100d6d73a2cad7a30dea",
      "mode": "0644"
    },
    {
      "path": "fractal_agent/adapters/claude.py",
      "sha256": "b70333ca0f846c50de04e09364c022d0f5647bc4b4afe0f6abb91b5dc1176a29",
      "mode": "0644"
    },
    {
      "path": "fractal_agent/adapters/common.py",
      "sha256": "41508ccd3d2392be3df7da3c92ddd39503543b0f3b03961a35d2adaffd32de0a",
      "mode": "0644"
    },
    {
      "path": "fractal_agent/host_bridge.py",
      "sha256": "1c184e070fa8c7ce35e457e0eaae081f51957382b00cfd0785e94dc296656e5c",
      "mode": "0644"
    },
    {
      "path": "activation/kimi.json",
      "sha256": "892b190a86730063ae2e08c7a6149c0639713557fdaf73de23c7714e17f37742",
      "mode": "0644"
    }
  ],
  "capabilities": {
    "change_detection": "native_post_tool",
    "closeout": "nonblocking_reminder",
    "constraint_delivery_proof": "unsupported",
    "constraints": "active_read",
    "rules": "shared_rules",
    "skills": "shared_agents_dir"
  },
  "id": "kimi",
  "manifest_schema_version": 1,
  "owned_node_template_hash": "892b190a86730063ae2e08c7a6149c0639713557fdaf73de23c7714e17f37742",
  "owner_id": "ai.fractal.kimi.v1",
  "rules_path": "~/.config/fractal-agent/rules/current",
  "skill_source": "~/.agents/skills/fractal-self-description",
  "variants": [
    "kimi-cli"
  ],
  "verification": {
    "discover": "native_probe",
    "effective": "native_probe",
    "invoke": "native_probe"
  }
}
