{
  "action_contract_version": 1,
  "adapter": "fractal_agent.adapters.claude:normalize",
  "adapter_version": "1.3.0",
  "artifacts": [
    {
      "path": "fractal_agent/adapters/claude.py",
      "sha256": "b70333ca0f846c50de04e09364c022d0f5647bc4b4afe0f6abb91b5dc1176a29",
      "mode": "0644"
    },
    {
      "path": "fractal_agent/adapters/common.py",
      "sha256": "41508ccd3d2392be3df7da3c92ddd39503543b0f3b03961a35d2adaffd32de0a",
      "mode": "0644"
    },
    {
      "path": "fractal_agent/host_bridge.py",
      "sha256": "1c184e070fa8c7ce35e457e0eaae081f51957382b00cfd0785e94dc296656e5c",
      "mode": "0644"
    },
    {
      "path": "activation/claude.json",
      "sha256": "71fa1f432f4d49cb9ddf33ec97d2aae774a3f5e474778504684270f0aaef52ac",
      "mode": "0644"
    }
  ],
  "capabilities": {
    "change_detection": "native_post_tool",
    "closeout": "blocking_gate",
    "constraint_delivery_proof": "host_acceptance_callback",
    "constraints": "native_inject",
    "rules": "native_rules",
    "skills": "shared_agents_dir"
  },
  "id": "claude",
  "manifest_schema_version": 1,
  "owned_node_template_hash": "71fa1f432f4d49cb9ddf33ec97d2aae774a3f5e474778504684270f0aaef52ac",
  "owner_id": "ai.fractal.claude.v1",
  "rules_path": "~/.config/fractal-agent/rules/current",
  "skill_source": "~/.agents/skills/fractal-self-description",
  "variants": [
    "claude-code"
  ],
  "verification": {
    "discover": "native_probe",
    "effective": "native_probe",
    "invoke": "native_probe"
  }
}
