{
  "action_contract_version": 1,
  "adapter": "fractal_agent.adapters.codex:normalize",
  "adapter_version": "1.3.0",
  "artifacts": [
    {
      "path": "fractal_agent/adapters/codex.py",
      "sha256": "c1bfa6fe3acb031105ccb268c78112068192413315151acba5fbbb6da5a768ed",
      "mode": "0644"
    },
    {
      "path": "fractal_agent/adapters/claude.py",
      "sha256": "b70333ca0f846c50de04e09364c022d0f5647bc4b4afe0f6abb91b5dc1176a29",
      "mode": "0644"
    },
    {
      "path": "fractal_agent/adapters/common.py",
      "sha256": "41508ccd3d2392be3df7da3c92ddd39503543b0f3b03961a35d2adaffd32de0a",
      "mode": "0644"
    },
    {
      "path": "fractal_agent/host_bridge.py",
      "sha256": "1c184e070fa8c7ce35e457e0eaae081f51957382b00cfd0785e94dc296656e5c",
      "mode": "0644"
    },
    {
      "path": "activation/codex.json",
      "sha256": "8d87bf3fe82ab67f4bacdafb360ab443a3e4d08f2b11395728eb2f4ae9cfc1a6",
      "mode": "0644"
    }
  ],
  "capabilities": {
    "change_detection": "native_post_tool",
    "closeout": "nonblocking_reminder",
    "constraint_delivery_proof": "unsupported",
    "constraints": "active_read",
    "rules": "agents_md",
    "skills": "shared_agents_dir"
  },
  "id": "codex",
  "manifest_schema_version": 1,
  "owned_node_template_hash": "8d87bf3fe82ab67f4bacdafb360ab443a3e4d08f2b11395728eb2f4ae9cfc1a6",
  "owner_id": "ai.fractal.codex.v1",
  "rules_path": "~/.config/fractal-agent/rules/current",
  "skill_source": "~/.agents/skills/fractal-self-description",
  "variants": [
    "codex-cli",
    "codex-desktop"
  ],
  "verification": {
    "discover": "native_probe",
    "effective": "native_probe",
    "invoke": "native_probe"
  }
}
